{
  "schema_version": "1.0",
  "evaluation_id": "retrieval-holdout-r01",
  "evaluation_layer": "retrieval",
  "attempt_number": 1,
  "threshold_policy_version": "retrieval-threshold-v1",
  "threshold_policy_sha256": "7dc913e6b9469ce45a2f1e6c0b6ecc6e9ee3caa7e52da49e36b971c86527eff7",
  "threshold_frozen": true,
  "score_threshold": 0.46,
  "top_k": 5,
  "case_count": 12,
  "supported_case_count": 6,
  "unsupported_case_count": 6,
  "supported_recall_at_5": 1.0,
  "supported_hit_rate_at_5": 1.0,
  "supported_top1_accuracy": 0.83333333,
  "supported_mrr": 0.91666667,
  "unsupported_fallback_accuracy": 0.5,
  "status_accuracy": 0.75,
  "logical_api_calls": 12,
  "physical_attempts": 12,
  "generation_api_calls": 0,
  "prompt_tokens": 230,
  "total_tokens": 230,
  "failed_case_ids": ["HOLD-N01", "HOLD-N02", "HOLD-N04"],
  "supported_quality_passed": true,
  "unsupported_fallback_passed": false,
  "holdout_supported_floor": 0.52130791,
  "holdout_unsupported_ceiling": 0.52337769,
  "holdout_scalar_separation_gap": -0.00206978,
  "threshold_only_separation_possible": false,
  "threshold_changed": false,
  "retrieval_decision": "HOLDOUT_FAILED",
  "next_evaluation": "full_rag_holdout_r01",
  "source_summary_sha256": "171615ba3636835e5f3fadf66b09a41fcc036acf1838dc67f8b9770d0242d631",
  "index_manifest_sha256": "cb9c47e0ef4a62771b15894bcfcbfbb6966af588169ebc17427ed00f14906b79",
  "chunks_sha256": "a49ad2a4c3b8dc767277566be60e93cd2a8d3113ffe1c598eec9ccfb759b02c4",
  "processed_manifest_sha256": "9f2a32488d6a46083df39de0121cd6df62f2be7fae7de4981bab31c1f801edca",
  "index_plan_sha256": "5c7be0bfb3f6d79ae173611436599efaf8af9036e4bc532c8cee0a754fbf9d28",
  "case_outcomes": [
    {"case_id": "HOLD-P01", "kind": "supported", "expected_status": "found", "actual_status": "found", "result_count": 3, "expected_document_id": "NSI-POL-OPS-001", "expected_rank": 1, "expected_document_score": 0.66742085, "top_document_id": "NSI-POL-OPS-001", "top_score": 0.66742085, "passed": true},
    {"case_id": "HOLD-P02", "kind": "supported", "expected_status": "found", "actual_status": "found", "result_count": 2, "expected_document_id": "NSI-POL-OPS-001", "expected_rank": 1, "expected_document_score": 0.57778652, "top_document_id": "NSI-POL-OPS-001", "top_score": 0.57778652, "passed": true},
    {"case_id": "HOLD-P03", "kind": "supported", "expected_status": "found", "actual_status": "found", "result_count": 2, "expected_document_id": "NSI-POL-PEO-001", "expected_rank": 1, "expected_document_score": 0.62196815, "top_document_id": "NSI-POL-PEO-001", "top_score": 0.62196815, "passed": true},
    {"case_id": "HOLD-P04", "kind": "supported", "expected_status": "found", "actual_status": "found", "result_count": 5, "expected_document_id": "NSI-POL-PRV-001", "expected_rank": 2, "expected_document_score": 0.52130791, "top_document_id": "NSI-POL-OPS-001", "top_score": 0.53141234, "passed": true},
    {"case_id": "HOLD-P05", "kind": "supported", "expected_status": "found", "actual_status": "found", "result_count": 2, "expected_document_id": "NSI-TAB-COV-001", "expected_rank": 1, "expected_document_score": 0.58995556, "top_document_id": "NSI-TAB-COV-001", "top_score": 0.58995556, "passed": true},
    {"case_id": "HOLD-P06", "kind": "supported", "expected_status": "found", "actual_status": "found", "result_count": 4, "expected_document_id": "NSI-TAB-DIR-001", "expected_rank": 1, "expected_document_score": 0.53160610, "top_document_id": "NSI-TAB-DIR-001", "top_score": 0.53160610, "passed": true},
    {"case_id": "HOLD-N01", "kind": "unsupported-near-domain", "expected_status": "no_evidence", "actual_status": "found", "result_count": 2, "expected_document_id": null, "expected_rank": null, "expected_document_score": null, "top_document_id": "NSI-POL-PEO-001", "top_score": 0.48314752, "passed": false},
    {"case_id": "HOLD-N02", "kind": "unsupported-near-domain", "expected_status": "no_evidence", "actual_status": "found", "result_count": 2, "expected_document_id": null, "expected_rank": null, "expected_document_score": null, "top_document_id": "NSI-TAB-COV-001", "top_score": 0.50435659, "passed": false},
    {"case_id": "HOLD-N03", "kind": "unsupported-medical", "expected_status": "no_evidence", "actual_status": "no_evidence", "result_count": 0, "expected_document_id": null, "expected_rank": null, "expected_document_score": null, "top_document_id": null, "top_score": null, "passed": true},
    {"case_id": "HOLD-N04", "kind": "unsupported-business", "expected_status": "no_evidence", "actual_status": "found", "result_count": 5, "expected_document_id": null, "expected_rank": null, "expected_document_score": null, "top_document_id": "NSI-TAB-DIR-001", "top_score": 0.52337769, "passed": false},
    {"case_id": "HOLD-N05", "kind": "unsupported-operational", "expected_status": "no_evidence", "actual_status": "no_evidence", "result_count": 0, "expected_document_id": null, "expected_rank": null, "expected_document_score": null, "top_document_id": null, "top_score": null, "passed": true},
    {"case_id": "HOLD-N06", "kind": "unsupported-out-of-domain", "expected_status": "no_evidence", "actual_status": "no_evidence", "result_count": 0, "expected_document_id": null, "expected_rank": null, "expected_document_score": null, "top_document_id": null, "top_score": null, "passed": true}
  ],
  "failed_cases": [
    {"case_id": "HOLD-N01", "kind": "unsupported-near-domain", "actual_status": "found", "result_count": 2, "top_document_id": "NSI-POL-PEO-001", "top_score": 0.48314752, "failure_reason_code": "near_domain_false_positive"},
    {"case_id": "HOLD-N02", "kind": "unsupported-near-domain", "actual_status": "found", "result_count": 2, "top_document_id": "NSI-TAB-COV-001", "top_score": 0.50435659, "failure_reason_code": "near_domain_false_positive"},
    {"case_id": "HOLD-N04", "kind": "unsupported-business", "actual_status": "found", "result_count": 5, "top_document_id": "NSI-TAB-DIR-001", "top_score": 0.52337769, "failure_reason_code": "organization_context_false_positive"}
  ]
}
